{
  "uid": "007",
  "recipient": {
    "type": "email",
    "hashed": true,
    "salt": "deadsea",
    "identity": "sha256$c7ef86405ba71b85acd8e2e95166c4b111448089f2e1599f42fe1bba46e865c5"
  },
  "image": "https://example.org/extended-badge-longcat.png",
  "evidence": "https://example.org/super-exciting-evidence.html",
  "issuedOn": 1359217910,
  "badge": "https://example.org/badgeClass.json",
  "verify": {
    "type": "hosted",
    "url": "https://example.org/assertions/007.json"
  }
}